{
  "address": "UPI<acoustics,1,music,musical_notes>",
  "title": "Equal Temperament Musical Notes and Pitch Frequency Mapping",
  "description": "Mathematical and physical mapping of Western 12-tone equal temperament (12-TET) musical notes to acoustic fundamental frequencies, pitch notation, staff clefs (G-klav and F-klav), and duration ratios.",
  "status": "EST",
  "quantities": [
    {
      "name": "A4_reference_pitch",
      "value": 440.0,
      "unit": "Hz",
      "reference": "ISO 16:1975 Acoustics Tuning Standard"
    },
    {
      "name": "C4_middle_c_frequency",
      "value": 261.6256,
      "unit": "Hz",
      "uncertainty": 0.0001
    },
    {
      "name": "semitone_frequency_ratio",
      "value": 1.0594630943592953,
      "unit": "dimensionless"
    }
  ],
  "definitions": [
    "Musical Note: Named pitch standard corresponding to a fundamental acoustic oscillation frequency (Hz).",
    "12-TET: 12-tone equal temperament where the octave ratio (2:1) is divided into 12 logarithmic semitones.",
    "Staff Notation: 5-line musical grid mapping pitch (vertical position/clef) and time duration (note shapes)."
  ],
  "equations": [
    "f(n) = f_0 * 2^(n / 12)",
    "N8 = f / (8 Hz)"
  ],
  "assumptions": [
    "A4 standard reference tuning is set to 440.0 Hz.",
    "Tuning system uses 12-tone equal temperament (12-TET)."
  ],
  "mechanism": "Acoustic pressure waves generated by vibrating strings, columns of air, or membranes create fundamental frequencies perceived as distinct musical pitches.",
  "evidence": [
    {
      "type": "calculation",
      "source": "ISO 16:1975 Acoustics - Standard Tuning Frequency",
      "confidence": 1.0,
      "notes": "12-TET pitch frequencies calculated logarithmically relative to A4 = 440 Hz."
    }
  ],
  "information_layer": "PUBLIC",
  "tags": [
    "acoustics",
    "music_theory",
    "12_tet",
    "pitch_notation",
    "frequencies"
  ]
}
